{
  "ok": true,
  "feature": "marketphase",
  "meta": {
    "symbol": "ATEN",
    "generatedAt": "2026-03-09T07:19:11.594Z",
    "fetchedAt": "2026-03-09T07:19:11.594Z",
    "ttlSeconds": 86400,
    "provider": "internal",
    "dataset": "ATEN",
    "source": "marketphase",
    "status": "OK",
    "version": "8.0",
    "methodologyVersion": "8.0",
    "precision": "IEEE754-Double-Round6",
    "auditTrail": {
      "generatedBy": "MarketPhase-v8-Engine",
      "commitHash": "667760b",
      "reviewDate": "2026-03-09T07:19:11.594Z",
      "standards": [
        "ISO-8000",
        "IEEE-7000"
      ]
    },
    "legal": "MarketPhase AI — Scientific Elliott Research (v8.0)\nprovides deterministic, rule-based historical analysis only.\nIt does not forecast future prices or offer financial advice.\nUse solely for educational and research purposes.\nISO 8000 / IEEE 7000 Compliant - Bit-exact reproducibility guaranteed."
  },
  "data": {
    "features": {
      "RSI": 60.630762,
      "MACDHist": 0.038919,
      "ATR%": 1.718518,
      "SMA50": 18.575312,
      "SMA200": 17.973318,
      "SMATrend": "bullish",
      "lastClose": 20.47
    },
    "swings": {
      "raw": [
        {
          "index": 13,
          "date": "2025-03-13",
          "price": 16.1642,
          "type": "low"
        },
        {
          "index": 21,
          "date": "2025-03-25",
          "price": 17.5754,
          "type": "high"
        },
        {
          "index": 31,
          "date": "2025-04-08",
          "price": 14.6939,
          "type": "low"
        },
        {
          "index": 39,
          "date": "2025-04-21",
          "price": 15.0985,
          "type": "low"
        },
        {
          "index": 55,
          "date": "2025-05-13",
          "price": 17.6839,
          "type": "high"
        },
        {
          "index": 63,
          "date": "2025-05-23",
          "price": 16.8631,
          "type": "low"
        },
        {
          "index": 73,
          "date": "2025-06-09",
          "price": 18.1602,
          "type": "high"
        },
        {
          "index": 77,
          "date": "2025-06-13",
          "price": 17.5067,
          "type": "low"
        },
        {
          "index": 90,
          "date": "2025-07-03",
          "price": 19.9426,
          "type": "high"
        },
        {
          "index": 96,
          "date": "2025-07-14",
          "price": 17.6354,
          "type": "low"
        },
        {
          "index": 103,
          "date": "2025-07-23",
          "price": 18.7741,
          "type": "high"
        },
        {
          "index": 124,
          "date": "2025-08-21",
          "price": 16.8818,
          "type": "low"
        },
        {
          "index": 145,
          "date": "2025-09-22",
          "price": 18.2133,
          "type": "high"
        },
        {
          "index": 150,
          "date": "2025-09-29",
          "price": 17.9649,
          "type": "low"
        },
        {
          "index": 155,
          "date": "2025-10-06",
          "price": 18.5511,
          "type": "high"
        },
        {
          "index": 163,
          "date": "2025-10-16",
          "price": 17.1401,
          "type": "low"
        },
        {
          "index": 171,
          "date": "2025-10-28",
          "price": 18.0344,
          "type": "high"
        },
        {
          "index": 172,
          "date": "2025-10-29",
          "price": 17.3786,
          "type": "low"
        },
        {
          "index": 187,
          "date": "2025-11-19",
          "price": 16.5012,
          "type": "low"
        },
        {
          "index": 201,
          "date": "2025-12-10",
          "price": 18.4355,
          "type": "high"
        },
        {
          "index": 227,
          "date": "2026-01-20",
          "price": 16.9,
          "type": "low"
        },
        {
          "index": 237,
          "date": "2026-02-03",
          "price": 17.2191,
          "type": "low"
        },
        {
          "index": 243,
          "date": "2026-02-11",
          "price": 20.8683,
          "type": "high"
        },
        {
          "index": 250,
          "date": "2026-02-23",
          "price": 18.94,
          "type": "low"
        }
      ],
      "confirmed": [
        {
          "index": 21,
          "date": "2025-03-25",
          "price": 17.5754,
          "type": "high"
        },
        {
          "index": 31,
          "date": "2025-04-08",
          "price": 14.6939,
          "type": "low"
        },
        {
          "index": 39,
          "date": "2025-04-21",
          "price": 15.0985,
          "type": "low"
        },
        {
          "index": 55,
          "date": "2025-05-13",
          "price": 17.6839,
          "type": "high"
        },
        {
          "index": 63,
          "date": "2025-05-23",
          "price": 16.8631,
          "type": "low"
        },
        {
          "index": 77,
          "date": "2025-06-13",
          "price": 17.5067,
          "type": "low"
        },
        {
          "index": 90,
          "date": "2025-07-03",
          "price": 19.9426,
          "type": "high"
        },
        {
          "index": 96,
          "date": "2025-07-14",
          "price": 17.6354,
          "type": "low"
        },
        {
          "index": 103,
          "date": "2025-07-23",
          "price": 18.7741,
          "type": "high"
        },
        {
          "index": 124,
          "date": "2025-08-21",
          "price": 16.8818,
          "type": "low"
        },
        {
          "index": 155,
          "date": "2025-10-06",
          "price": 18.5511,
          "type": "high"
        },
        {
          "index": 163,
          "date": "2025-10-16",
          "price": 17.1401,
          "type": "low"
        },
        {
          "index": 171,
          "date": "2025-10-28",
          "price": 18.0344,
          "type": "high"
        },
        {
          "index": 187,
          "date": "2025-11-19",
          "price": 16.5012,
          "type": "low"
        },
        {
          "index": 201,
          "date": "2025-12-10",
          "price": 18.4355,
          "type": "high"
        },
        {
          "index": 227,
          "date": "2026-01-20",
          "price": 16.9,
          "type": "low"
        },
        {
          "index": 237,
          "date": "2026-02-03",
          "price": 17.2191,
          "type": "low"
        },
        {
          "index": 243,
          "date": "2026-02-11",
          "price": 20.8683,
          "type": "high"
        }
      ]
    },
    "elliott": {
      "completedPattern": {
        "valid": false,
        "direction": "bullish",
        "endedAt": "2026-02-11",
        "confidence0_100": 100,
        "rules": {
          "r1": false,
          "r2": true,
          "r3": true
        },
        "guidelineScore": 72,
        "rulePasses": 2
      },
      "developingPattern": {
        "possibleWave": "Wave 4 or ABC",
        "confidence": 60,
        "fibLevels": {
          "support": [
            17.649706,
            16.788494
          ],
          "resistance": [
            20.437694,
            21.298906
          ]
        },
        "disclaimer": "Reference levels only -- no prediction"
      },
      "uncertainty": {
        "lastSwingConfirmed": true,
        "alternativeCounts": 2,
        "confidenceDecay": {
          "base": 100,
          "adjusted": 76
        }
      },
      "fib": {
        "ratios": {
          "wave2": 1.26161,
          "wave3": 1.0015,
          "wave4": 0.207815,
          "wave5": 2.38012
        },
        "conformanceScore": 60.585474
      }
    },
    "fib": {
      "ratios": {
        "wave2": 1.26161,
        "wave3": 1.0015,
        "wave4": 0.207815,
        "wave5": 2.38012
      },
      "conformanceScore": 60.585474
    },
    "multiTimeframeAgreement": null,
    "debug": {
      "symbol": "ATEN",
      "window": 6,
      "candidateCount": 24,
      "durationMs": 0
    },
    "disclaimer": "MarketPhase AI — Scientific Elliott Research (v8.0)\nprovides deterministic, rule-based historical analysis only.\nIt does not forecast future prices or offer financial advice.\nUse solely for educational and research purposes.\nISO 8000 / IEEE 7000 Compliant - Bit-exact reproducibility guaranteed."
  },
  "error": null
}
