{
  "ok": true,
  "feature": "marketphase",
  "meta": {
    "symbol": "LII",
    "generatedAt": "2026-03-08T07:46:14.976Z",
    "fetchedAt": "2026-03-08T07:46:14.976Z",
    "ttlSeconds": 86400,
    "provider": "internal",
    "dataset": "LII",
    "source": "marketphase",
    "status": "OK",
    "version": "8.0",
    "methodologyVersion": "8.0",
    "precision": "IEEE754-Double-Round6",
    "auditTrail": {
      "generatedBy": "MarketPhase-v8-Engine",
      "commitHash": "bc3eeec",
      "reviewDate": "2026-03-08T07:46:14.976Z",
      "standards": [
        "ISO-8000",
        "IEEE-7000"
      ]
    },
    "legal": "MarketPhase AI — Scientific Elliott Research (v8.0)\nprovides deterministic, rule-based historical analysis only.\nIt does not forecast future prices or offer financial advice.\nUse solely for educational and research purposes.\nISO 8000 / IEEE 7000 Compliant - Bit-exact reproducibility guaranteed."
  },
  "data": {
    "features": {
      "RSI": 41.522657,
      "MACDHist": -4.9811,
      "ATR%": 1.917339,
      "SMA50": 525.193648,
      "SMA200": 540.239942,
      "SMATrend": "bearish",
      "lastClose": 517.47
    },
    "swings": {
      "raw": [
        {
          "index": 9,
          "date": "2025-03-07",
          "price": 600.826,
          "type": "high"
        },
        {
          "index": 13,
          "date": "2025-03-13",
          "price": 553.1846,
          "type": "low"
        },
        {
          "index": 17,
          "date": "2025-03-19",
          "price": 585.7908,
          "type": "high"
        },
        {
          "index": 31,
          "date": "2025-04-08",
          "price": 505.6522,
          "type": "low"
        },
        {
          "index": 40,
          "date": "2025-04-22",
          "price": 553.6006,
          "type": "high"
        },
        {
          "index": 41,
          "date": "2025-04-23",
          "price": 503.909,
          "type": "low"
        },
        {
          "index": 58,
          "date": "2025-05-16",
          "price": 601.2867,
          "type": "high"
        },
        {
          "index": 79,
          "date": "2025-06-17",
          "price": 533.4922,
          "type": "low"
        },
        {
          "index": 94,
          "date": "2025-07-10",
          "price": 614.2178,
          "type": "high"
        },
        {
          "index": 104,
          "date": "2025-07-24",
          "price": 661.1363,
          "type": "high"
        },
        {
          "index": 115,
          "date": "2025-08-08",
          "price": 579.2081,
          "type": "low"
        },
        {
          "index": 122,
          "date": "2025-08-19",
          "price": 610.3279,
          "type": "high"
        },
        {
          "index": 131,
          "date": "2025-09-02",
          "price": 540.7859,
          "type": "low"
        },
        {
          "index": 135,
          "date": "2025-09-08",
          "price": 577.4869,
          "type": "high"
        },
        {
          "index": 148,
          "date": "2025-09-25",
          "price": 513.5362,
          "type": "low"
        },
        {
          "index": 157,
          "date": "2025-10-08",
          "price": 553.1206,
          "type": "high"
        },
        {
          "index": 166,
          "date": "2025-10-21",
          "price": 547.5453,
          "type": "high"
        },
        {
          "index": 172,
          "date": "2025-10-29",
          "price": 486.4964,
          "type": "low"
        },
        {
          "index": 174,
          "date": "2025-10-31",
          "price": 503.6711,
          "type": "high"
        },
        {
          "index": 188,
          "date": "2025-11-20",
          "price": 443.0909,
          "type": "low"
        },
        {
          "index": 202,
          "date": "2025-12-11",
          "price": 513.5051,
          "type": "high"
        },
        {
          "index": 206,
          "date": "2025-12-17",
          "price": 486.1872,
          "type": "low"
        },
        {
          "index": 215,
          "date": "2025-12-31",
          "price": 485.58,
          "type": "low"
        },
        {
          "index": 222,
          "date": "2026-01-12",
          "price": 533.25,
          "type": "high"
        },
        {
          "index": 233,
          "date": "2026-01-28",
          "price": 487.49,
          "type": "low"
        },
        {
          "index": 245,
          "date": "2026-02-13",
          "price": 566.65,
          "type": "high"
        }
      ],
      "confirmed": [
        {
          "index": 9,
          "date": "2025-03-07",
          "price": 600.826,
          "type": "high"
        },
        {
          "index": 17,
          "date": "2025-03-19",
          "price": 585.7908,
          "type": "high"
        },
        {
          "index": 41,
          "date": "2025-04-23",
          "price": 503.909,
          "type": "low"
        },
        {
          "index": 58,
          "date": "2025-05-16",
          "price": 601.2867,
          "type": "high"
        },
        {
          "index": 79,
          "date": "2025-06-17",
          "price": 533.4922,
          "type": "low"
        },
        {
          "index": 104,
          "date": "2025-07-24",
          "price": 661.1363,
          "type": "high"
        },
        {
          "index": 122,
          "date": "2025-08-19",
          "price": 610.3279,
          "type": "high"
        },
        {
          "index": 135,
          "date": "2025-09-08",
          "price": 577.4869,
          "type": "high"
        },
        {
          "index": 148,
          "date": "2025-09-25",
          "price": 513.5362,
          "type": "low"
        },
        {
          "index": 157,
          "date": "2025-10-08",
          "price": 553.1206,
          "type": "high"
        },
        {
          "index": 166,
          "date": "2025-10-21",
          "price": 547.5453,
          "type": "high"
        },
        {
          "index": 174,
          "date": "2025-10-31",
          "price": 503.6711,
          "type": "high"
        },
        {
          "index": 188,
          "date": "2025-11-20",
          "price": 443.0909,
          "type": "low"
        },
        {
          "index": 202,
          "date": "2025-12-11",
          "price": 513.5051,
          "type": "high"
        },
        {
          "index": 215,
          "date": "2025-12-31",
          "price": 485.58,
          "type": "low"
        },
        {
          "index": 222,
          "date": "2026-01-12",
          "price": 533.25,
          "type": "high"
        },
        {
          "index": 233,
          "date": "2026-01-28",
          "price": 487.49,
          "type": "low"
        }
      ]
    },
    "elliott": {
      "completedPattern": {
        "valid": false,
        "direction": "bearish",
        "endedAt": "2026-01-28",
        "confidence0_100": 16,
        "rules": {
          "r1": false,
          "r2": false,
          "r3": false
        },
        "guidelineScore": 52,
        "rulePasses": 0
      },
      "developingPattern": {
        "possibleWave": "Wave 4 or ABC",
        "confidence": 10,
        "fibLevels": {
          "support": [
            492.88968,
            482.09032
          ],
          "resistance": [
            527.85032,
            538.64968
          ]
        },
        "disclaimer": "Reference levels only -- no prediction"
      },
      "uncertainty": {
        "lastSwingConfirmed": true,
        "alternativeCounts": 2,
        "confidenceDecay": {
          "base": 16,
          "adjusted": 0
        }
      },
      "fib": {
        "ratios": {
          "wave2": 1.16233,
          "wave3": 0.460961,
          "wave4": 1.707066,
          "wave5": 0.755362
        },
        "conformanceScore": 39.595866
      }
    },
    "fib": {
      "ratios": {
        "wave2": 1.16233,
        "wave3": 0.460961,
        "wave4": 1.707066,
        "wave5": 0.755362
      },
      "conformanceScore": 39.595866
    },
    "multiTimeframeAgreement": null,
    "debug": {
      "symbol": "LII",
      "window": 6,
      "candidateCount": 26,
      "durationMs": 1
    },
    "disclaimer": "MarketPhase AI — Scientific Elliott Research (v8.0)\nprovides deterministic, rule-based historical analysis only.\nIt does not forecast future prices or offer financial advice.\nUse solely for educational and research purposes.\nISO 8000 / IEEE 7000 Compliant - Bit-exact reproducibility guaranteed."
  },
  "error": null
}
